review,sentiment
"This product exceeded my expectations!",positive
"I absolutely love this item.",positive
"Great quality and fast delivery!",positive
"Best purchase I've made in years.",positive
"Amazing customer service and great product.",positive
"Highly recommend, very satisfied!",positive
"Fantastic product, works perfectly!",positive
"Excellent value for money.",positive
"Outstanding quality, will buy again!",positive
"Very happy with my purchase, great experience!",positive
"This is terrible, worst purchase ever.",negative
"I hate this product so much.",negative
"Extremely disappointed with the quality.",negative
"Awful experience, would not recommend.",negative
"Waste of money, complete disaster.",negative
"Horrible quality and poor service.",negative
"I regret buying this, really bad.",negative
"Terrible customer support, very upset.",negative
"Worst product ever, extremely disappointed.",negative
"Do not buy this, it's terrible!",negative
"Not what I expected but acceptable.",positive
"It works okay, pretty decent.",positive
"Decent product for the price.",positive
"Good enough, satisfied with purchase.",positive
"Nice quality, good value.",positive
"Decent overall, some minor issues.",positive
"Pretty good, would recommend.",positive
"Good product, arrived quickly.",positive
"Satisfied with this purchase overall.",positive
"Pretty decent, met expectations.",positive
"Not very good, disappointed.",negative
"Could be better, quality issues.",negative
"Not satisfied, has defects.",negative
"Poor quality, expected much better.",negative
"Unsatisfactory, many problems.",negative
"Not worth the money.",negative
"Disappointed, lots of issues.",negative
"Poor quality and bad service.",negative
"Below expectations, not happy.",negative
"Not what I wanted, disappointed.",negative
